status,reported,description,address,type,occurred
OPEN,2019-11-13 15:24:00+00:00,Officer took a report of a threat.,POUND BUILDING 1563 MASSACHUSETTS AVE CAMBRIDGE,THREAT(S),11/9/19 - 6:00 PM 11/13/19 - 4:00 PM
CLOSED,2019-08-05 10:21:00+00:00,Officer dispatched to take a report of damage done to a pipe in the building.,LONGWOOD CAMPUS OPERATIONS 180 LONGWOOD AVE BOSTON,PROPERTY DAMAGE,7/20/19 - 12:00 PM 7/25/19 - 9:00 AM
CLOSED,2019-07-16 07:11:00+00:00,"Officers dispatched to a report of two unwanted guests near the entrance of the building. Officers arrived, located the   
individuals, and sent them on their way.",LITTAUER HKS 79 JFK ST CAMBRIDGE,UNWANTED GUEST,"7/16/19
7:11 AM"
CLOSED,2019-06-26 12:38:00+00:00,"Officers dispatched to a report of a drone being operated in the area. Officers arrived, located the operators, and        reported that they received the necessary permission to operate the drone.",ATHLETICS - OHIRI FIELD 82 N HARVARD ST ALLSTON,SUSPICIOUS ACTIVITY,6/26/19 12:38 PM
CLOSED,2019-07-26 12:34:00+00:00,"Officers dispatched to a report of a brush fire. Officers arrived and reported that approximately thirty feet of brush had ignited and caused damage to a motor vehicle parked in the immediate area. Shortly after officers arrival, Boston Fire     arrived on scene and extinguished the fire. Upon consultation with Boston Fire, officers reported that the mulch under the brush would be sprayed with water in an effort to prevent any further fires in the brush.",SPANGLER CENTER LOT 117 WESTERN AVE ALLSTON,FIRE,7/26/19 12:30 PM - 1:10 PM
CLOSED,2019-06-04 07:29:00+00:00,Officer while on patrol was approached by an individual who inquired if they had any active warrants. The individual was   then run for wants/warrants with negative results and sent on their way.,1380 MASSACHUSETTS AVECAMBRIDGE,ASSIST CAMBRIDGE POLICE,6/4/19 7:30 AM - 7:40 AM
CLOSED,2019-06-07 12:00:00+00:00,Officer while on detail reported that a bicyclist had struck a motor vehicle. Officer reported that the bicyclist did not  suffer any personal injuries.,SPANGLER CENTER LOT 117 WESTERN AVE ALLSTON,MOTOR VEHICLE ACCIDENT,6/7/19 12:00 PM
CLOSED,2019-06-03 03:43:00+00:00,Officer dispatched to a report of an individual loitering outside of the building. Officer arrived and reported that the   individual was gone on arrival.,HILLES SOC 59 SHEPARD ST CAMBRIDGE,SUSPICIOUS ACTIVITY,6/3/19 3:43 AM
CLOSED,2019-07-02 16:31:00+00:00,Officer dispatched to take a report of stolen U.S. currency valued at $60.00 and a recovered stolen wallet valued at       $20.00.,NEW RESEARCH BUILDING 77 AVE LOUIS PASTEUR BOSTON,THEFT REPORT,7/2/19 12:30 PM - 4:00 PM
CLOSED,2020-04-18 00:44:00+00:00,Officers dispatched to a report of a noise complaint. Officers arrived and advised the occupants to keep the noise level   down.,PEABODY TERRACE 21 900 MEMORIAL DR CAMBRIDGE,NOISE COMPLAINT,4/18/20 0:44 AM
CLOSED,2019-07-11 18:04:00+00:00,Officers dispatched to a report of an individual engaged in suspicious activity in the area. Officers arrived and reported that the individual was gone on arrival.,CRONKHITE GRADUATE CENTER 84 BRATTLE ST CAMBRIDGE,SUSPICIOUS ACTIVITY,7/11/19 6:04 PM
CLOSED,2019-06-19 07:37:00+00:00,"Officers dispatched to a report of an unwanted guest sleeping in the lot. Officers arrived, located the individual, and   
conducted a field interview. The individual was run for wants/warrants with negative results but did show positive results
for an active trespass warning. The individual was informed that a criminal complaint for trespassing would be sought     
regarding this matter and then transported to a medical facility by Pro Ambulance",HARVARD EXTENSION SCHOOL LOT - 51 BRATTLE ST CAMBRIDGE,TRESPASSING,"6/19/19
7:35 AM - 8:30 AM"
CLOSED,2019-11-15 00:58:00+00:00,Officers dispatched to a report of a noise complaint. Officers arrived and reported that the area was quiet.,SOLDIERS FIELD PARK 06 111 WESTERN AVE ALLSTON,NOISE COMPLAINT,11/15/19 0:58 AM
OPEN,2019-09-03 08:18:00+00:00,"Officer dispatched to take a report of a stolen Goyard Tote bag valued at $1,000.00 and miscellaneous clothing items       valued at $2,000.00.",PEABODY TERRACE 24 900 MEMORIAL DR CAMBRIDGE,THEFT REPORT,8/31/19 - 7:00 PM 9/3/19 - 8:00 AM
CLOSED,2019-04-23 17:31:00+00:00,"Officer dispatched to take a report of a stolen Vittoria bicycle tire valued at $50.00. The reporting individual informed 
the officer that the rest of the bicycle was still secured to the bike rack in front of the building.",MATTHEWS HALL NORTH 9 HARVARD YARD CAMBRIDGE,THEFT REPORT,"4/22/19 - 6:00 PM
4/23/19 - 3:30 PM"
OPEN,2019-04-01 10:51:00+00:00,Officer dispatched to take a report of a shattered rear window to a motor vehicle.,TEELE HALL LOT 230 WESTERN AVE ALLSTON,VANDALISM,"3/29/19
9:00 AM - 5:00 PM"
CLOSED,2019-11-06 22:14:00+00:00,Officers dispatched to a report of an individual refusing to leave the facility after the building had closed. Officers    arrived and reported that the individual was gone on arrival.,MALKIN ATHLETIC CENTER 39 HOLYOKE ST CAMBRIDGE,UNWANTED GUEST,11/6/19 10:14 PM
CLOSED,2019-07-12 07:58:00+00:00,"Officers dispatched to a report of an individual causing a disturbance. Officers arrived, located the individual, and     
conducted a field interview. During the field interview, the individual showed positive results for an active trespass    
warning. The individual was then re-issued a verbal trespass warning for all Harvard University property and informed that
a criminal complaint for trespassing would be sought regarding this matter and sent on their way.",CASPERSEN STUDENT CENTER 1585 MASSACHUSETTS AVE CAMBRIDGE,TRESPASSING,"7/12/19
7:55 AM - 8:15 AM"
CLOSED,2019-07-30 17:11:00+00:00,Officer dispatched to a report of a film crew by the entrance of the building. Officer arrived and reported that the group was gone on arrival.,WIDENER LIBRARY 31 HARVARD YARD CAMBRIDGE,REMOVE GROUP,7/30/19 5:11 PM
CLOSED,2019-06-15 10:51:00+00:00,Officer dispatched to a report of an argument between two individuals. Officer arrived and spoke to one of the individuals who stated that the other individual had become upset due to the lack of parking near the building. The officer then       located the other individual near the building and sent them on their way.,29 GARDEN STCAMBRIDGE,DISTURBANCE,6/15/19 10:51 AM - 11:44 AM
CLOSED,2019-05-24 17:18:00+00:00,"Officers dispatched to a report of an individual engaging in suspicious activity in the building. Officers arrived and    
reported individual gone on arrival.",SMITH CAMPUS CENTER 1350 MASSACHUSETTS AVE CAMBRIDGE,SUSPICIOUS ACTIVITY,"5/24/19
5:18 PM"
CLOSED,2020-03-13 21:49:00+00:00,Officers dispatched to a report of a noise complaint. Officers arrived and advised the occupants to keep the noise level   down.,85 PRESCOTT STREETCAMBRIDGE,NOISE COMPLAINT,3/13/20 9:49 PM
CLOSED,2019-06-23 12:09:00+00:00,Officer took a walk-in report of stolen Cubitts glasses valued at $475.00 and a Philips electric toothbrush valued at      $75.00.,SHAW HALL 16 EVERETT ST CAMBRIDGE,THEFT REPORT,5/31/19 12:09 PM - 12:29 PM
CLOSED,2019-06-29 01:49:00+00:00,"Officers dispatched to a report of an unwanted guest sleeping on a bench. Officers arrived, located the individual, and    sent them on their way.",JFK PARK 968 MEMORIAL DR CAMBRIDGE,ASSIST STATE POLICE,6/29/19 1:49 AM
OPEN,2019-09-26 09:25:00+00:00,Officer dispatched to take a report of a bias-related note.,BARKER CENTER 12 QUINCY ST CAMBRIDGE,SUSPICIOUS ACTIVITY,9/25/19 - 3:00 PM 9/26/19 - 9:40 AM
CLOSED,2019-10-01 14:07:00+00:00,"Officers dispatched to a report of an individual playing loud music outside of the building. Officers arrived, located the individual, and sent them on their way.",8 STORY STCAMBRIDGE,UNWANTED GUEST,10/1/19 2:07 PM
CLOSED,2019-07-30 12:09:00+00:00,"Officers dispatched to a report of an unwanted guest laying on the ground. Officers arrived, located the individual, and   sent them on their way.",90 MT. AUBURN STCAMBRIDGE,UNWANTED GUEST,7/30/19 12:09 PM
CLOSED,2020-01-27 21:45:00+00:00,Officer dispatched to a report of a fire alarm. Officer arrived and reported that the alarm was caused by a cracked water  pipe on the second floor. Officer reported that Operations and fire mechanics arrived on scene and began to clean up the   affected areas.,WELD HALL 3 HARVARD YARD CAMBRIDGE,PROPERTY DAMAGE,1/27/20 9:45 PM - 10:45 PM
CLOSED,2019-05-27 14:01:00+00:00,"Officer took a report of a stolen rose gold iPhone 8S valued at $600.00, a clear telephone case valued at $20.00 and a    
debit/credit card.",ATHLETICS - CUMNOCK FIELD 2 79 N HARVARD ST ALLSTON,THEFT REPORT,"5/26/19
8:20 PM - 9:00 PM"
OPEN,2020-01-16 18:24:00+00:00,Officer dispatched to take a report of a threat.,SMITH CAMPUS CENTER 1350 MASSACHUSETTS AVE CAMBRIDGE,THREAT(S),1/16/20 6:00 PM - 6:30 PM
CLOSED,2019-10-12 12:39:00+00:00,"Officer while on a detail received a report of an individual scalping tickets. Officer arrived, located the individual,",ATHLETICS - MURR CENTER 65 N HARVARD ST ALLSTON,FIELD INTERVIEW,10/12/09 12:40 PM - 12:50 PM
CLOSED,2019-12-13 12:37:00+00:00,Officers dispatched to take a report of a disturbance.,DUNSTER HOUSE 945 MEMORIAL DR CAMBRIDGE,DISTURBANCE,12/13/19 11:15 AM - 1:00 PM
OPEN,2019-11-18 11:48:00+00:00,"Officer dispatched to take a report of a stolen unattended and unsecured Lenovo laptop valued at $1,000.00.",PERKINS HALL 35 OXFORD ST CAMBRIDGE,THEFT REPORT,11/18/19 10:30 AM - 11:00 AM
OPEN,2020-05-15 11:37:00+00:00,Officer took a report of a suspicious voicemail.,CRONKHITE GRADUATE CENTER 84 BRATTLE ST CAMBRIDGE,SUSPICIOUS CALL/TEXT/MAIL/SOCI,5/15/20 5:43 AM - 5:46 AM
CLOSED,2019-12-31 11:40:00+00:00,Officer obtained a copy of a restraining order.,HARVARD UNIVERSITY POLICE DEPA 1033-6 MASSACHUSETTS AVE CAMBRIDGE,209 A SERVICE,12/31/19 11:40 AM - 11:45 AM
CLOSED,2019-05-24 16:13:00+00:00,"Officer dispatched to take a report of a previous unwanted guest in the building. Officer arrived and located the         
reporting party who stated that an individual had arrived unexpectedly on two prior occasions and caused occupants to feel
uncomfortable. Officer then contacted the individual via the telephone and issued them a verbal trespass warning for all  
Harvard University property.",MORGAN HALL 15 HARVARD WAY ALLSTON,TRESPASS WARNING,"5/23/19 - 2:30 PM
5/24/19 - 3:30 PM"
CLOSED,2019-09-19 09:41:00+00:00,"Officers dispatched to a report of an unwanted guest in the building. Officers arrived, located the individual, and        conducted a field interview. During the field interview, the individual was run for wants/warrants with negative results   and then sent on their way.",AUSTIN HALL 1515 MASSACHUSETTS AVE CAMBRIDGE,FIELD INTERVIEW,9/19/19 9:40 AM - 10:10 AM
CLOSED,2020-03-14 21:37:00+00:00,Officer dispatched to a report of a small barrel fire in the building. Officer arrived and reported that the fire was      extinguished by the caller prior to the officer's arrival.,ARMENISE BUILDING 1 210-1 LONGWOOD AVE BOSTON,FIRE,3/14/20 9:37 PM
OPEN,2020-02-29 12:05:00+00:00,"Officer dispatched to take a report of an unlawful entry into a residence and a stolen Apple Macbook laptop valued at      $1,500.00, a Samsung laptop valued at $1,000.00, a charger valued at $30.00, and a black Jansport backpack valued at       $30.00.",LOWELL HOUSE E 10 HOLYOKE PL CAMBRIDGE,THEFT REPORT,2/29/20 0:01 AM - 0:40 AM
CLOSED,2020-04-18 20:47:00+00:00,"Officers dispatched to a report of an individual engaged in suspicious activity in the area. Officers arrived, located the individual, and reported that all was well.",LONGFELLOW HALL 13 APPIAN WAY CAMBRIDGE,SUSPICIOUS ACTIVITY,4/18/20 8:47 PM
CLOSED,2019-06-05 07:57:00+00:00,"Officers dispatched to a report of an unwanted guest in the alleyway behind the building. Officers arrived, located the    individual, and sent them on their way.",8 STORY STCAMBRIDGE,UNWANTED GUEST,6/5/19 7:57 AM
CLOSED,2019-07-20 00:33:00+00:00,"Officer dispatched to a report of an individual with a flashlight inside of the stadium. Prior to officer's arrival, the   reporting party called back and stated that the individual was a contractor working inside of the building.",ATHLETICS - STADIUM 79 N HARVARD ST ALLSTON,SUSPICIOUS ACTIVITY,7/20/19 0:33 AM
CLOSED,2019-07-20 22:00:00+00:00,Officer dispatched to take a report of an attempted unarmed robbery.,MILL ST / MEMORIAL DRCAMBRIDGE,ASSIST CAMBRIDGE POLICE,7/20/19 9:00 PM - 9:02 PM
OPEN,2019-06-01 17:14:00+00:00,"Officer dispatched to take a report of a stolen blue Retrospec Mountain bicycle valued at $450.00. The reporting          
individual informed the officer that their bicycle was secured to a bike rack with a cable lock valued at $25.00, which   
was also stolen.",SCIENCE CENTER 1 OXFORD ST CAMBRIDGE,THEFT REPORT,"5/20/19 - 12:00 PM
5/23/19 - 10:00 AM"
CLOSED,2019-05-08 16:08:00+00:00,"Officer dispatched to take a report of a stolen dark blue Marin bicycle valued at $700.00 and a black cable lock valued at
$20.00.",HEMENWAY GYMNASIUM H 1515 MASSACHUSETTS AVE CAMBRIDGE,THEFT REPORT,"4/24/19 - 12:00 PM
5/8/19 - 3:30 PM"
OPEN,2019-06-17 13:06:00+00:00,Officer took a walk-in report of harassment.,HARVARD UNIVERSITY HEALTH SERV 75 MT AUBURN ST CAMBRIDGE,HARASSMENT,"5/12/19 - 12:00 PM
6/17/19 - 11:30 AM"
CLOSED,2020-01-17 13:26:00+00:00,Officer dispatched to take a report of an assault and battery.,1651 MASSACHUSETTS AVECAMBRIDGE,ASSIST CAMBRIDGE POLICE,1/17/20 1:25 PM - 1:55 PM
CLOSED,2019-09-09 16:50:00+00:00,"Officers dispatched to a report of an individual who resembled a suspect in previous bicycle thefts loitering around the   bike racks near the building. Officers arrived, located the individual, and conducted a field interview. During the field  interview, the individual was run for wants/warrants with negative results. Following the field interview, the individual  was issued a verbal trespass warning for all Harvard University property and sent on their way.",HARVARD KENNEDY SCHOOL COURTYA 79 JFK ST CAMBRIDGE,TRESPASS WARNING,9/9/19 4:40 PM - 5:30 PM
OPEN,2019-12-17 14:17:00+00:00,Officers dispatched to a report of a disturbance. Officers and Cambridge Police arrived and located the reporting person   who stated that two individuals had engaged in an assault and battery. Officers and Cambridge Police then performed a      search of the immediate area and reported that atleast one of the individuals was gone on arrival.,PEABODY TERRACE VISITOR LOT 159 BANKS ST CAMBRIDGE,ASSAULT REPORT,12/17/19 2:17 PM
OPEN,2019-06-19 17:45:00+00:00,"Officer dispatched to take a report of a stolen beige Specialized bicycle valued at $5,000.00. The reporting individual   
informed the officer that their bicycle was secured to the bike rack with a cable lock valued at $30.00, which was also   
stolen.",NEW RESEARCH BUILDING 77 AVE LOUIS PASTEUR BOSTON,THEFT REPORT,"6/19/19
7:50 AM - 5:20 PM"
OPEN,2020-01-07 08:51:00+00:00,Officer took a report of a stolen package containing two jackets valued at $580.00.,180 LONGWOOD AVEBOSTON,THEFT REPORT,12/12/19 - 8:00 AM 12/18/19 - 12:09 PM
CLOSED,2020-02-10 11:13:00+00:00,Officer dispatched to take a report of a motor vehicle accident with no personal injuries.,BROADWAY GARAGE 7 FELTON ST CAMBRIDGE,MOTOR VEHICLE ACCIDENT,2/10/20 11:00 AM - 11:10 AM
OPEN,2020-05-11 09:22:00+00:00,Officer took a report of suspicious mail.,MASSACHUSETTS HALL 11 HARVARD YARD CAMBRIDGE,SUSPICIOUS CALL/TEXT/MAIL/SOCI,4/21/20 - 12:00 PM 5/7/20 - 12:24 PM
OPEN,2020-05-14 12:58:00+00:00,Officer took a report of stolen clothing valued at $350.00 from the laundry room of the building.,SOLDIERS FIELD PARK 01 111 WESTERN AVE ALLSTON,THEFT REPORT,5/14/20 11:00 AM - 12:45 PM
CLOSED,2019-10-12 19:41:00+00:00,Officer while on a detail reported a drone being operated in the area. Officer reported that the drone had been observed   for approximately five minutes and then flew out of sight shortly thereafter.,ATHLETICS - STADIUM 79 N HARVARD ST ALLSTON,SUSPICIOUS ACTIVITY,10/12/19 4:45 PM - 4:50 PM
CLOSED,2019-05-10 08:20:00+00:00,"Officers dispatched to a report of an unwanted guest causing a disturbance in the alleyway behind the building. Officers  
arrived, located the individual, and conducted a field interview. The individual was run for wants/warrants with negative 
results. The individual was then issued a verbal trespass warning for all Harvard University property and sent on their   
way.",8 STORY ST,TRESPASS WARNING             ,"5/10/19
8:25 AM - 9:00 AM"
OPEN,2019-11-16 12:03:00+00:00,"Officer dispatched to take a report of a stolen unattended and unsecured black Madewell backpack valued at $200.00         containing a green Ralph Lauren wallet valued at $40.00, portable charger valued at $70.00, drivers license, and           debit/credit cards.",MUSEUM NATURAL HISTORY 26 OXFORD ST CAMBRIDGE,THEFT REPORT,11/16/19 12:00 PM - 12:10 PM
CLOSED,2019-06-17 13:12:00+00:00,Officer dispatched to a report of an unattended backpack on the fifth floor of the building. Officer arrived and reported  that the owner was notified that their property was found.,SCIENCE CENTER 1 OXFORD ST CAMBRIDGE,SUSPICIOUS MAIL/ PACKAGE/BAG,6/17/19 1:12 PM
CLOSED,2019-03-15 05:07:00+00:00,Officer dispatched to take a report of tagging/graffiti done to a bathroom stall.,CARPENTER CENTER 24 QUINCY ST CAMBRIDGE,VANDALISM,"3/15/19
5:07 AM - 5:40 AM"
CLOSED,2020-06-01 14:11:00+00:00,Officer took a report of threats of vandalism.,1414 MASSACHUSETTS AVECAMBRIDGE,ASSIST CAMBRIDGE POLICE,5/31/20 11:50 AM
ARREST,2019-06-18 20:52:00+00:00,"Officers dispatched to a report of a disturbance and possible assault in the area. Officers arrived and reported that      Cambridge Police was on scene and had detained an individual actively screaming and resisting arrest. Officers approached  Cambridge Police and reported that CPD had been responding to a possible assault in progress, when the individual was      observed attempting to flee the immediate area and subsequently detained. While on scene, officers were then approached by three juveniles who wished to report a recent assault committed by the individual. According to the three juveniles, the",JOHN HARVARD STATUE 1 HARVARD YARD CAMBRIDGE,ASSAULT REPORT,6/18/19 8:50 PM - 9:20 PM
CLOSED,2019-05-03 00:29:00+00:00,"Officers dispatched to a report of an individual engaging in suspicious activity in their motor vehicle. Officers arrived 
and reported that the individual was just playing a video game.",SOLDIERS FIELD PARK LOT 111 WESTERN AVE ALLSTON,SUSPICIOUS ACTIVITY,"5/3/19
0:29 AM"
CLOSED,2020-03-15 08:38:00+00:00,"Officer dispatched to a report of a noise complaint. Officer arrived and reported that Cambridge Police was on scene, and  that the noise was due to construction.",65 MT AUBURN STCAMBRIDGE,NOISE COMPLAINT,3/15/20 8:38 AM
CLOSED,2019-11-10 19:53:00+00:00,"Officer dispatched to a report of the odor of marijuana inside of the building. Officer arrived and reported that no odor  could be detected on scene, however, the odor may have been previously emitting from the ventilation system.",PEABODY TERRACE 11 900 MEMORIAL DR CAMBRIDGE,SUSPICIOUS ACTIVITY,11/10/19 7:45 PM - 8:15 PM
CLOSED,2019-06-10 11:31:00+00:00,Officer dispatched to take a report of a motor vehicle accident with no personal injuries. Officer arrived and spoke to    the individual who stated while backing out of a parking space they struck another motor vehicle. Officer reports one,BUSINESS SCHOOL LOT 112 WESTERN AVE ALLSTON,MOTOR VEHICLE ACCIDENT,6/10/19 11:25 AM - 11:45 AM
OPEN,2020-05-04 10:05:00+00:00,Officer took a report of the attempted theft of four packages from the lobby of the building.,TERRY TERRACE - 19 EVERETT 19 EVERETT ST CAMBRIDGE,THEFT REPORT,5/4/20 9:00 AM - 9:30 AM
OPEN,2019-07-23 09:25:00+00:00,Officer dispatched to take a report of a bomb threat.,SMITH CAMPUS CENTER 1350 MASSACHUSETTS AVE CAMBRIDGE,BOMB THREAT,7/23/19 9:17 AM - 9:45 AM
CLOSED,2019-07-19 22:20:00+00:00,"Officer dispatched to a report of several individuals refusing to leave the area. Officers arrived and reported that a    
family was experiencing motor vehicle issues and were awaiting the arrival of a car service.  Officer reported that all",KIRKLAND HOUSE - HICKS HOUSE 64 JFK ST CAMBRIDGE,SUSPICIOUS ACTIVITY,"7/19/19
10:20 PM"
CLOSED,2019-12-04 15:14:00+00:00,Officers dispatched to a report of individuals throwing snowballs. Officers arrived and reported that the individuals were gone on arrival.,ATHLETICS - STADIUM 79 N HARVARD ST ALLSTON,SUSPICIOUS ACTIVITY,12/4/19 3:14 PM
CLOSED,2019-04-17 04:01:00+00:00,"Officers dispatched to a report of an individual causing a disturbance in front of the building. Officers arrived, located
the individual, and conducted a field interview. The individual was run for wants/warrants with negative results. The     
individual was then issued a verbal trespass warning for all Harvard University property and sent on their way.",THAYER HALL NORTH 21 HARVARD YARD CAMBRIDGE,TRESPASS WARNING,"4/17/19
3:30 AM - 4:00 AM"
CLOSED,2019-07-15 10:24:00+00:00,Officer while on patrol observed an individual possibly attempting to urinate against a building. Officer approached the   individual and conducted a field interview. Officer reported that the individual was not attempting to urinate and sent    them on their way.,STORY STCAMBRIDGE,FIELD INTERVIEW,7/15/19 10:25 AM - 10:35 AM
CLOSED,2019-07-17 07:53:00+00:00,"Officers dispatched to a report of an unwanted guest in front of the building. Officers arrived, located the individual,   and sent them on their way.",8 STORY STCAMBRIDGE,UNWANTED GUEST,7/17/19 7:53 AM
OPEN,2020-03-03 12:42:00+00:00,Officer dispatched to take a report of a stolen black and red Specialized mountain bike valued at $800.00 and a bicycle    pump valued at $15.00. The reporting individual informed the officer that their bicycle was secured inside of the bicycle  cage with a cable lock that was damaged and left at the scene.,WARREN ALPERT BUILDING 200 LONGWOOD AVE BOSTON,THEFT REPORT,2/21/20 - 0:01 AM 3/2/20 - 7:15 PM
CLOSED,2019-04-14 01:00:00+00:00,"Officers dispatched to a report of a noise complaint. Officers arrived and advised occupants of apartment 903 to keep the 
noise level down.",PEABODY TERRACE 24 900 MEMORIAL DR CAMBRIDGE,NOISE COMPLAINT,"4/14/19
1:00 AM"
CLOSED,2019-10-11 22:46:00+00:00,Officers dispatched to a report of several unwanted guests. Officers arrived and reported that the individuals were gone   on arrival.,8 STORY STCAMBRIDGE,UNWANTED GUEST,10/11/19 10:46 PM
CLOSED,2019-09-12 16:41:00+00:00,"Officers dispatched to a report of an unlawful entry into the building. Officers arrived, located the individual outside   of the building, and conducted a field interview. Following the field interview, the individual was transported to the     Harvard University Police Department and run for wants/warrants with negative results. The individual was then transported to a medical facility by Pro Ambulance.",FACULTY ROW 52B 52 LINNAEAN ST CAMBRIDGE,THEFT REPORT,9/12/19 4:38 PM - 4:44 PM
OPEN,2019-12-16 11:29:00+00:00,Officer dispatched to take a report of annoying telephone calls.,WHRB 387 HARVARD ST CAMBRIDGE,ANNOYING CALLS/TEXTS/EMAILS,12/14/19 6:00 AM - 8:00 AM
CLOSED,2020-02-17 21:55:00+00:00,Officer took a report of an individual throwing an item out of their window that struck a passing motor vehicle.,40 DEWOLFE STCAMBRIDGE,ASSIST CAMBRIDGE POLICE,2/17/20 9:50 PM - 10:20 PM
CLOSED,2019-06-23 12:09:00+00:00,Officer took a walk-in report of stolen Cubitts glasses valued at $475.00 and a Philips electric toothbrush valued at      $75.00.,SHAW HALL 16 EVERETT ST CAMBRIDGE,THEFT REPORT,5/31/19 12:09 PM - 12:29 PM
CLOSED,2020-05-06 21:02:00+00:00,Officers dispatched to a report of a noise complaint. Officers arrived and advised the occupants to keep the noise level   down.,20 PRESCOTT STCAMBRIDGE,NOISE COMPLAINT,5/6/20 9:02 PM
CLOSED,2019-09-14 16:46:00+00:00,Officers dispatched to a report of an individual engaged in suspicious activity. Officers arrived and reported that the    individual fled the immediate area upon their arrival.,ROSOVSKY HALL 52 MT AUBURN ST CAMBRIDGE,UNWANTED GUEST,9/14/19 4:46 PM
CLOSED,2020-05-20 15:29:00+00:00,Officer while on patrol observed several individuals skateboarding in the area. Officer approached the individuals and     sent them on their way.,RUBENSTEIN BUILDING 1 ELIOT ST CAMBRIDGE,SKATEBOARD/BIKE COMPLAINT,5/20/20 3:29 PM
CLOSED,2019-12-03 15:33:00+00:00,Officers dispatched to monitor a demonstration that occurred without incident.,EMERSON HALL 26 HARVARD YARD CAMBRIDGE,DEMONSTRATION,12/3/19 3:33 PM - 5:30 PM
CLOSED,2019-04-17 16:03:00+00:00,Officer took a walk-in report of harassment.,HARVARD UNIVERSITY POLICE DEPA 1033-6 MASSACHUSETTS AVE CAMBRIDGE,ASSIST SOMERVILLE POLICE,"11/1/18 - 3:00 PM
4/17/19 - 5:30 PM"
