status,reported,description,address,type,occurred
CLOSED,2019-04-08 12:00:00+00:00,"Officers dispatched to a report of several individuals gathered in the trash room of the building. Officers arrived,      
located the individuals, and reported the odor of marijuana. When officers attempted to approach the individuals, they    
then began to flee the area. One of the individuals was stopped and a field interview was conducted. Following the field  
interview, the individual was escorted off the property.",9-13 WARE ST 9 WARE ST CAMBRIDGE,FIELD INTERVIEW,"4/8/19
11:50 AM - 12:30 PM"
OPEN,2019-04-12 11:17:00+00:00,Officer dispatched to take a report of fraud.,GORDON HALL 25 SHATTUCK ST BOSTON,FRAUD,"3/18/19 - 4:05 PM
4/11/19 - 12:00 PM"
CLOSED,2019-04-23 16:29:00+00:00,"Officers dispatched to a report of an unwanted guest in the building. Officers arrived, located the individual, and       
conducted a field interview. The individual was run for wants/warrants with negative results. The individual was then     
issued a verbal trespass warning for Andover Hall and sent on their way.",ANDOVER HALL 45 FRANCIS AVE CAMBRIDGE,TRESPASS WARNING,"4/23/19
4:33 PM - 4:50 PM"
CLOSED,2019-04-24 15:35:00+00:00,"Officer dispatched to a report of an individual engaging in suspicious activity in the restroom of the building. Officer  
arrived and reported that the request for service was a result of a misunderstanding and that the individual was exiting  
the restroom on arrival.",SMITH CAMPUS CENTER 1350 MASSACHUSETTS AVE CAMBRIDGE,SUSPICIOUS ACTIVITY,"4/24/19
3:35 PM - 3:45 PM"
CLOSED,2019-11-26 01:35:00+00:00,Officer dispatched to a report of an individual engaged in suspicious activity. Officer arrived and reported that the      individual was gone on arrival.,RADCLIFFE QUAD 107 SHEPARD ST CAMBRIDGE,SUSPICIOUS ACTIVITY,11/26/19 1:35 AM
CLOSED,2019-08-27 05:33:00+00:00,Officer dispatched to take a report of bias related tagging/graffiti done to the building.,SCHLESINGER LIBRARY 3 JAMES ST CAMBRIDGE,VANDALISM,8/27/19 5:33 AM - 5:49 AM
CLOSED,2019-03-29 11:47:00+00:00,"Officers dispatched to a report of an individual requesting permission from pedestrians to ride their bicycle and use     
their headphones. Officers arrived and reported individual gone on arrival.",WIDENER LIBRARY 31 HARVARD YARD CAMBRIDGE,SUSPICIOUS ACTIVITY,"3/29/19
11:47 AM"
CLOSED,2019-09-15 00:05:00+00:00,Officers dispatched to a report of a loud party. Officers arrived and reported that the music would be turned down for the evening.,PEABODY TERRACE 11 900 MEMORIAL DR CAMBRIDGE,LOUD PARTY,9/15/19 0:05 AM
OPEN,2020-05-12 20:49:00+00:00,Officer dispatched to take a report of a forcible breaking and entering into the basement of the building.,CANADAY HALL G 22 HARVARD YARD CAMBRIDGE,THEFT REPORT,5/12/20 7:00 PM - 7:45 PM
CLOSED,2019-03-16 10:51:00+00:00,Officer dispatched to take a report of vandalism done to a window on the side of the building.,176 LINCOLN ST 176 LINCOLN ST ALLSTON,VANDALISM,"3/16/19
10:51 AM - 11:18 AM"
CLOSED,2019-10-28 17:04:00+00:00,Officer took a report of peeping and spying.,LANDMARK CENTER 401 PARK DR BOSTON,ASSIST BOSTON POLICE,10/28/19 3:00 PM
CLOSED,2019-10-08 13:36:00+00:00,Officer dispatched to take a report of tagging/graffiti done to the side of the building.,176 LINCOLN STALLSTON,VANDALISM,10/8/19 0:01 AM - 1:30 PM
CLOSED,2019-06-01 11:52:00+00:00,Officer dispatched to take a report of a motor vehicle accident with no personal injuries.,BUSINESS SCHOOL LOT 112 WESTERN AVE ALLSTON,MOTOR VEHICLE ACCIDENT,"5/31/19 - 10:00 PM
6/1/19 - 3:45 AM"
CLOSED,2019-07-31 17:25:00+00:00,Officer dispatched to a report of an individual engaged in suspicious activity in the driveway of the building. Officer    arrived and reported that the individual was gone on arrival.,1033 MASSACHUSETTS AVECAMBRIDGE,SUSPICIOUS ACTIVITY,7/31/19 5:25 PM
OPEN,2020-05-20 10:41:00+00:00,"Officer took a report of a stolen silver women's bicycle valued at $140.00. The reporting individual informed the officer  that their bicycle was secured to a bike rack with a cable lock valued at $20.00, which was also stolen.",CHAO CENTER 49 HARVARD WAY ALLSTON,THEFT REPORT,5/17/20 - 6:00 PM 5/19/20 - 6:00 PM
CLOSED,2019-05-18 03:22:00+00:00,"Officers dispatched to a report of loud music coming from inside of the building. Officers arrived and advised occupants  
of room G-12 to keep the noise level down.",WIGGLESWORTH HALL C 6 HARVARD YARD CAMBRIDGE,NOISE COMPLAINT,"5/18/19
3:22 AM"
CLOSED,2020-04-02 01:32:00+00:00,Officer while on patrol reported a motor vehicle accident with no personal injuries. Cambridge Police arrived on scene     shortly thereafter and took jurisdiction over the incident.,JOHNSTON GATE 1465 MASSACHUSETTS AVE CAMBRIDGE,ASSIST CAMBRIDGE POLICE,4/2/20 1:22 AM - 1:45 AM
OPEN,2019-09-24 08:44:00+00:00,Officer took a report of an assault.,MORGAN HALL 15 HARVARD WAY ALLSTON,ASSAULT REPORT,9/24/19 8:30 AM - 9:20 AM
OPEN,2019-08-28 07:45:00+00:00,Officer dispatched to take a report of a suspicious email.,MEMORIAL CHURCH 23 HARVARD YARD CAMBRIDGE,SUSPICIOUS CALL/TEXT/MAIL/SOCI,8/27/19 - 3:05 PM 8/28/19 - 8:20 AM
CLOSED,2019-11-26 00:01:00+00:00,Officers dispatched to a report of the odor of marijuana inside of the building. Officers arrived and reported that no     suspicious odor could be detected.,VANDERBILT HALL 107 AVE LOUIS PASTEUR BOSTON,SUSPICIOUS ACTIVITY,11/26/19 0:01 AM
CLOSED,2019-04-25 16:42:00+00:00,Officer while on patrol observed a film crew in the area. Officer approached the film crew and reported that there had,HARVARD YARD 1 PEABODY ST CAMBRIDGE,REMOVE GROUP,"4/25/19
4:42 PM"
CLOSED,2019-08-11 18:28:00+00:00,"Officer while on patrol observed two individuals in possession of several clear plastic bags that appeared to contain a    marijuana like substance. Officer reported that the two individuals were then observed removing the substance from the     plastic bags, grinding the substance, and rolling what appeared to be a marijuana cigarette. Officer then approached the individuals and conducted a field interview. During the field interview, the individuals were run for wants/warrants with 
negative results. The individuals were then issued a verbal trespass warnings for all Harvard University property and sent
on their way.",FORBES PLAZA 1350 MASSACHUSETTS AVE CAMBRIDGE,TRESPASS WARNING,8/11/19 6:20 PM - 6:28 PM
OPEN,2019-08-10 17:59:00+00:00,"Officer dispatched to take a report of a stolen black and white Schwinn Central bicycle valued at $400.00 and a black and  red Zefal helmet valued at $25.00. The reporting individual informed the officer that their bicycle was secured to a bike  rack with a chain lock valued at $15.00, which was also stolen.",LAMONT LIBRARY 11 QUINCY ST CAMBRIDGE,THEFT REPORT,8/10/19 2:45 PM - 5:15 PM
CLOSED,2019-06-17 23:38:00+00:00,Officer dispatched to a report of a suspicious odor in the building. Officer arrived and reported that no suspicious odor  could be detected.,TERRY TERRACE - 15 EVERETT 15 EVERETT ST CAMBRIDGE,SUSPICIOUS ODOR/SMOKE,6/17/19 11:38 PM
CLOSED,2020-02-07 15:08:00+00:00,Officers dispatched to a report of several unwanted guests in the garage. Officers arrived and reported that the           individuals were gone on arrival.,BROADWAY GARAGE 7 FELTON ST CAMBRIDGE,REMOVE GROUP,2/7/20 3:08 PM
OPEN,2020-05-27 09:08:00+00:00,Officer took a report of a stolen green and blue suitcase valued at $150.00 from the lobby of the building.,29 GARDEN STCAMBRIDGE,THEFT REPORT,5/26/20 - 11:50 AM 5/27/20 - 8:00 AM
ARREST,2019-11-06 10:26:00+00:00,"Officer while on patrol observed an individual known to them with two active warrants. Officer approached the individual   and made several commands for them to stop, however, the individual refused and continued to walk away. An additional      officer then arrived to the scene and the individual was placed under arrest for Warrant Service and subsequently          transported to the Harvard University Police Department for booking.                                                                                                                                                                                  Name: Fitch, Edward                                                                                                        Age: 31                                                                                                                    Address: 17 Whitehead Ave, Hull, MA 02045                                                                                  Charge(s): Warrant Service",MASSACHUSETTS AVE / LINDEN STCAMBRIDGE,WARRANT ARREST,11/6/19 10:25 AM - 10:45 AM
CLOSED,2020-05-28 02:37:00+00:00,Officers dispatched to a report of a group of individuals engaged in suspicious activity in the area. Officers arrived and reported that the individuals were gone on arrival.,JOHN HARVARD STATUE 1 HARVARD YARD CAMBRIDGE,SUSPICIOUS ACTIVITY,5/28/20 2:37 AM
CLOSED,2019-05-13 11:32:00+00:00,Officers dispatched to take a report of a previous unwanted guest in the building.,FRESHMAN DEAN'S OFFICE 6 PRESCOTT ST CAMBRIDGE,UNWANTED GUEST,"5/13/19
11:32 AM - 12:00 PM"
CLOSED,2019-09-10 00:26:00+00:00,"Officers dispatched to a report of an unwanted guest. Officers arrived, located the individual, and sent them on their     way.",SHATTUCK INTERNATIONAL HOUSE - 203 PARK DR BOSTON,UNWANTED GUEST,9/10/19 0:26 AM
CLOSED,2019-09-11 23:09:00+00:00, ,3 SACRAMENTO STCAMBRIDGE,NOISE COMPLAINT,9/11/19 11:09 PM
OPEN,2019-08-15 19:08:00+00:00,Officer dispatched to take a report of a recovered-stolen red wallet valued at $50.00.,SMITH CAMPUS CENTER 1350 MASSACHUSETTS AVE CAMBRIDGE,THEFT REPORT,8/15/19 7:45 AM - 4:50 PM
OPEN,2020-01-28 22:50:00+00:00,Officer dispatched to take a report of stolen U.S. currency valued at approximately $80.00 and stolen Canadian currency    valued at $20.00.,HEMENWAY GYMNASIUM H 1515 MASSACHUSETTS AVE CAMBRIDGE,THEFT REPORT,1/28/20 9:00 PM - 10:30 PM
CLOSED,2019-11-27 19:54:00+00:00,Officer dispatched to a report of a noise complaint. Officer arrived and reported that the noise was due to construction   in the building and that contractors would arrive shortly to address the issue.,ADAMS HOUSE - CLAVERLY HALL 63 MT AUBURN ST CAMBRIDGE,NOISE COMPLAINT,11/27/19 7:54 PM
CLOSED,2019-06-06 05:44:00+00:00,"Officers dispatched to a report of an individual sleeping inside of the building. Officers arrived, located the           
individual, and conducted a field interview. The individual was run for wants/warrants with negative results. Officers    
then informed the individual of the policy regarding sleeping inside of the building and sent them on their way.",SPANGLER CENTER 117 WESTERN AVE ALLSTON,FIELD INTERVIEW,"6/6/19
5:44 AM - 6:17 AM"
CLOSED,2019-06-21 01:35:00+00:00,Officers dispatched to a report of an individual in need of assistance. Officers arrived and reported that Boston Police   was on scene shortly thereafter and took jurisdiction over the incident.,HUNTINGTON AVEBOSTON,ASSIST BOSTON POLICE,6/21/19 1:35 AM - 2:00 AM
CLOSED,2019-08-30 23:00:00+00:00,Officer dispatched to a report of a noise complaint outside of the building. Officer arrived and reported that the area    was quiet.,SOLDIERS FIELD PARK 09 111 WESTERN AVE ALLSTON,NOISE COMPLAINT,8/30/19 11:00 PM
OPEN,2019-11-21 15:52:00+00:00,Officer dispatched to take a report of a stolen unattended and unsecured dark blue Northface coat valued at $450.00        containing black leather gloves valued at $150.00.,ALDRICH HALL 35 HARVARD WAY ALLSTON,THEFT REPORT,11/20/19 3:00 PM - 8:00 PM
CLOSED,2019-07-01 19:18:00+00:00,"Officer dispatched to take a report of a stolen black Jamis bicycle valued at $900.00. The reporting individual informed   the officer that their bicycle was secured to a bike rack with a cable lock valued at $20.00, which was also stolen.",CRONKHITE GRADUATE CENTER 84 BRATTLE ST CAMBRIDGE,THEFT REPORT,6/30/19 2:00 PM - 5:00 PM
CLOSED,2019-06-20 18:35:00+00:00,Officer dispatched to take a report of tagging/graffiti done to a door of the building.,HUIT - 38 OXFORD 38 OXFORD ST CAMBRIDGE,VANDALISM,"6/19/19 - 10:30 PM
6/20/19 - 6:30 PM"
CLOSED,2019-07-22 09:39:00+00:00,"Officers dispatched to a report of two individuals performing bicycle tricks and coming in close proximately to            pedestrians. Officers arrived, located the individuals, and sent them on their way.",SCIENCE CENTER PLAZA 1 OXFORD ST CAMBRIDGE,SKATEBOARD/BIKE COMPLAINT,7/22/19 9:39 AM
OPEN,2019-10-01 17:39:00+00:00,"Officer dispatched to take a report of a stolen black Giant bicycle valued at $400.00 and miscellaneous accessories valued at $160.00. The reporting individual informed the officer that their bicycle had been secured in the bicycle cage. Upon    further inspection of the bicycle cage, officer reported that there had been a malfunction with the locking mechanism      which caused the door to be left unsecured.",LITTAUER HKS 79 JFK ST CAMBRIDGE,THEFT REPORT,10/1/19 10:20 AM - 5:30 PM
CLOSED,2019-10-13 13:54:00+00:00,"Officers dispatched to a report of several individuals skateboarding in the area. Officers arrived, located the            individuals, and sent them on their way.",HUAM ARTS CENTER 224 WESTERN AVE ALLSTON,SKATEBOARD/BIKE COMPLAINT,10/13/19 1:54 PM
OPEN,2019-06-18 14:28:00+00:00,Officer dispatched to take a report of several stolen chemicals from the building.,TOSTESON LABS 260 LONGWOOD AVE BOSTON,THEFT REPORT,6/7/19 - 12:00 PM 6/17/19 - 12:00 PM
CLOSED,2019-12-16 12:53:00+00:00,Officer dispatched to take a report of a motor vehicle accident with no personal injuries.,MALKIN ATHLETIC CENTER LOT 41 HOLYOKE ST CAMBRIDGE,MOTOR VEHICLE ACCIDENT,12/16/19 12:45 PM - 1:00 PM
OPEN,2020-05-19 15:13:00+00:00,Officer took a report of stolen food valued at $35.00 from the entrance of the building.,29 GARDEN STCAMBRIDGE,THEFT REPORT,5/19/20 1:40 PM - 2:40 PM
CLOSED,2020-05-06 15:32:00+00:00,"Officers dispatched to a report of an individual causing a disturbance in the area. Officers arrived and reported that     Cambridge Police was on scene and took jurisdiction over the incident, and that the individual was transported to a        medical facility by Pro Ambulance.",HARVARD SQUARE MBTA STATION 1400 MASSACHUSETTS AVE CAMBRIDGE,ASSIST CAMBRIDGE POLICE,5/6/20 3:15 PM - 3:30 PM
OPEN,2020-03-03 10:49:00+00:00,Officer dispatched to take a report of a stolen unattended and unsecured pink Razor scooter valued at $80.00.,CANADAY HALL C 22 HARVARD YARD CAMBRIDGE,THEFT REPORT,3/1/20 1:00 AM - 2:00 AM
CLOSED,2019-12-30 11:18:00+00:00,Officers dispatched to a report of suspicious activity. Officers arrived and reported that all was in order.,CONANT HALL 36 OXFORD ST CAMBRIDGE,SUSPICIOUS ACTIVITY,12/30/19 11:18 AM
CLOSED,2019-07-01 08:22:00+00:00,Officer dispatched to take a report of a stolen HUID card.,WELD HALL 3 HARVARD YARD CAMBRIDGE,ASSIST TPD - THEFT REPORT,6/30/19 - 3:00 PM 7/1/19 - 8:24 AM
ARREST,2019-05-18 05:06:00+00:00,"Officer dispatched to a report of an unwanted guest sleeping in the entryway of the building. Officer arrived, located the
individual, and conducted a field interview. The individual was run for wants/warrants with negative results but did show 
positive results for an active trespass warning for all Harvard University property. The individual was then informed that
they were being placed under arrest for Trespassing.                                                                      
                                                                                                                          
Name: Webster, James                                                                                                      
Age: 39                                                                                                                   
Address: 240 Albany St. Cambridge, MA 02128                                                                               
Charge(s): Trespassing",PEABODY TERRACE 31 900 MEMORIAL DR CAMBRIDGE,TRESPASSING,"5/18/19
5:00 AM - 5:30 AM"
CLOSED,2019-06-25 10:00:00+00:00,"Officer dispatched to take a report of a motor vehicle accident with no personal injuries.                                                                                                                                                            Update 6/28/19: Upon further review, this incident did not occur on HUPD Jurisdiction. This incident has been reclassified from a Motor Vehicle Accident to Assist Cambridge Police.",GARDEN STCAMBRIDGE,ASSIST CAMBRIDGE POLICE,6/25/19 9:55 AM - 10:00 AM
CLOSED,2019-09-03 15:06:00+00:00,"Officers dispatched to a report of an unwanted guest. Officers arrived, located the individual, and sent them on their     way.",SMITH CAMPUS CENTER 1350 MASSACHUSETTS AVE CAMBRIDGE,UNWANTED GUEST,9/3/19 3:06 PM
CLOSED,2019-08-11 07:57:00+00:00,"Officers dispatched to a report of a suspicious package in the stadium. Officers arrived and reported that Boston Police   was on scene. Officers and Boston Police then located the package and reported that Boston Police Bomb Squad was requested and arrived to the scene. Shortly thereafter, and upon consultation with Boston Police, officers reported that the package was deemed safe and that Boston Police took possession of the package.",ATHLETICS - STADIUM 79 N HARVARD ST ALLSTON,SUSPICIOUS MAIL/ PACKAGE/BAG,8/11/19 7:45 AM - 9:30 AM
CLOSED,2020-03-10 16:28:00+00:00,Officer dispatched to a report of a small mulch fire near the building. Officer arrived and reported that the fire was     extinguished by the Boston Fire Department. Officer also reported that there was no damage to the area.,KRESGE - SPH 677 HUNTINGTON AVE BOSTON,FIRE,3/10/20 4:26 PM - 4:50 PM
CLOSED,2019-07-10 00:06:00+00:00,"Officers dispatched to a report of an individual who may be in need of assistance. Officers arrived and reported that the 
individual was gone on arrival.",DANE HALL 22 EVERETT ST CAMBRIDGE,SUSPICIOUS ACTIVITY,"7/10/19
0:06 AM"
CLOSED,2020-03-15 15:21:00+00:00,"Officer dispatched to a report of a chemical spill. Officer arrived and reported that a small amount of ethanol was poured into a beaker that caused a flame to ignite. Officer reported that the flame was extinguish prior to their arrival and    
that EH&S and Harvard FMO had been notified of the incident.",NEW RESEARCH BUILDING 77 AVE LOUIS PASTEUR BOSTON,CHEMICAL SPILL,3/15/20 3:20 PM - 3:44 PM
OPEN,2019-08-30 14:30:00+00:00, ,WIDENER LIBRARY 31 HARVARD YARD CAMBRIDGE,OPEN & GROSS,8/30/19 2:25 PM - 2:34 PM
OPEN,2019-07-15 18:51:00+00:00,Officers dispatched to a report of an individual in the restroom for an extended period of time. Officers arrived and      reported that the individual was gone on arrival.,"HOLMES HALL, HLS 18 EVERETT ST CAMBRIDGE",UNWANTED GUEST,7/15/19 6:40 PM - 7:15 PM
ARREST,2019-06-22 09:24:00+00:00,"Officers dispatched to a report of an individual harassing pedestrians and kicking over property in the area. Officers     arrived and reported that Cambridge Police was on scene and speaking with an individual matching the description of the    person engaged in the harassing and disruptive behavior. Officers then approached Cambridge Police who reported that a     victim was in the immediate area seeking medical attention due to an assault committed by the aforementioned individual.   While at the scene, officers reported that the individual began to engage in increasingly erratic behavior and was         subsequently placed in handcuffs by Cambridge Police. Cambridge Police then reported that a witness to the incident        previously observed the individual in custody throw a glass bottle at the victim's backpack which subsequently broke apart upon impact with the ground. According to the witness, the individual then retrieved a shard of glass from the broken      bottle and lunged towards the victim. Shortly thereafter, the victim arrived to the scene and identified the individual in custody as the person who assaulted them with the glass bottle. The individual was then informed that they were being      placed under arrest and transported to the Harvard University Police Department for booking. While at the Department, the  individual was issued a verbal trespass warning for all Harvard University Property. Officers then performed an inventory  search of the individual's property and discovered several items of drug paraphernalia and a plastic bag containing a      white and clear crystal substance resembling Methamphetamine. Pro Ambulance was then requested and arrived on scene and    the individual was transported to a medical facility for further evaluation.                                                                                                                                                                          Name: Haugh, Francis                                                                                                       Age: 40                                                                                                                    Address: Homeless                                                                                                          Charge(s): Assault and Battery with a Dangerous Weapon (2 Counts)",HARVARD YARD 1 PEABODY ST CAMBRIDGE,ASSAULT REPORT,6/22/19 9:30 AM - 10:00 AM
OPEN,2019-06-18 15:42:00+00:00,Officer took a report of fraud.,25 TRAVIS STALLSTON,FRAUD,5/16/19 - 9:00 AM 6/18/19 - 9:00 AM
CLOSED,2019-11-03 22:15:00+00:00,Officer dispatched to a report of a noise complaint. Officer arrived and reported that Cambridge Police was on scene and,OWL CLUB 30 HOLYOKE ST CAMBRIDGE,ASSIST CAMBRIDGE POLICE,11/3/19 10:15 PM
CLOSED,2019-06-01 11:52:00+00:00,Officer dispatched to take a report of a motor vehicle accident with no personal injuries.,BUSINESS SCHOOL LOT 112 WESTERN AVE ALLSTON,MOTOR VEHICLE ACCIDENT,5/31/19 - 10:00 PM 6/1/19 - 3:45 AM
CLOSED,2019-03-30 20:36:00+00:00,"Officers dispatched to a report of an unwanted guest laying down in front of the building. Officers arrived, located the  
individual, and sent them on their way.",SEELY MUDD BUILDING 250 LONGWOOD AVE BOSTON,UNWANTED GUEST,"3/30/19
8:36 PM"
CLOSED,2019-11-16 17:01:00+00:00,Officers dispatched to a report of a possibly intoxicated individual inside of the building. Officers arrived and reported that the individual was gone on arrival.,BIOLOGY LAB 16 DIVINITY AVE CAMBRIDGE,UNWANTED GUEST,11/16/19 5:01 PM
CLOSED,2020-05-26 15:17:00+00:00,"Officers dispatched to a report of several individuals smoking cigarettes and drinking alcohol in the area. Officers       arrived, located the individuals, and sent them on their way.",LOEB FELLOWSHIP PROGRAM 48 TROWBRIDGE ST CAMBRIDGE,SUSPICIOUS ACTIVITY,5/26/20 3:17 PM
CLOSED,2019-07-31 10:59:00+00:00,"Officer dispatched to take a report of a stolen black Specialized bicycle valued at $1,300.00, a water bottle holder       valued at $20.00, and a cell phone holder valued at $20.00. The reporting individual informed the officer that their       bicycle was secured to a bike rack with a cable lock valued at $30.00, which was also stolen.",PEABODY TERRACE 02 900 MEMORIAL DR CAMBRIDGE,THEFT REPORT,7/30/19 - 2:30 PM 7/31/19 - 10:30 AM
CLOSED,2019-08-13 10:18:00+00:00,Officers dispatched to a report of an individual playing loud music in the area. Officers arrived and reported that the    individual was authorized to perform in the area.,SCIENCE CENTER PLAZA 1 OXFORD ST CAMBRIDGE,UNWANTED GUEST,8/13/19 10:18 AM
CLOSED,2019-06-03 17:04:00+00:00,"Officer dispatched to a report of the odor of gasoline coming from a motor vehicle inside of the garage. Officer arrived  
and reported that Boston Fire was on scene. Officer reported that the motor vehicle was moved outside of the garage and   
the building was then ventilated to remove the odor.",NEW RESEARCH BUILDING PARKING 77 AVE LOUIS PASTEUR BOSTON,HAZARDOUS CONDITION,"6/3/19
5:00 PM - 5:40 PM"
CLOSED,2019-06-07 16:21:00+00:00,Officer dispatched to take a report of suspicious mail.,MASSACHUSETTS HALL 11 HARVARD YARD CAMBRIDGE,SUSPICIOUS ACTIVITY,6/7/19 3:25 PM - 4:35 PM
OPEN,2019-10-16 12:36:00+00:00,Officer dispatched to take a report of a recovered stolen sign valued at $400.00.,ATHLETICS - BRIGHT LANDRY HOCK 65 N HARVARD ST ALLSTON,THEFT REPORT,10/12/19 0:01 AM - 10:00 AM
CLOSED,2019-04-11 12:19:00+00:00,"Officers dispatched to a report of a large media group gathering in the area. Officers arrived and reported that the group
dispersed without incident.",FACULTY CLUB 20 QUINCY ST CAMBRIDGE,ASSIST CAMBRIDGE POLICE,"4/11/19
12:19 PM"
CLOSED,2019-07-03 20:04:00+00:00,"Officers dispatched on the report of a potential drug overdose.  Officers arrived and discovered the individual was not   
overdosing.  The individual refused medical treatment.",JFK PARK 968 MEMORIAL DR CAMBRIDGE,ASSIST STATE POLICE,"7/3/19
8:00 PM - 8:25 PM"
CLOSED,2019-04-04 16:52:00+00:00,"Officer dispatched to a report of smoldering mulch in the courtyard. Officer arrived and reported mulch was hosed down by 
BFD.",SPANGLER CENTER 117 WESTERN AVE ALLSTON,FIRE,"4/4/19
4:52 PM"
CLOSED,2019-08-13 12:20:00+00:00,Officer dispatched to take a report of unwanted comments directed towards a pedestrian by the operator of a passing motor  vehicle.,KENT STBROOKLINE,ASSIST OTHER PD,8/13/19 8:30 AM - 9:30 AM
OPEN,2020-06-02 02:49:00+00:00,Officer dispatched to take a report of vandalism done to a lamp outside the building.,LOWELL HOUSE A 10 HOLYOKE PL CAMBRIDGE,VANDALISM,6/2/20 2:30 AM - 3:15 AM
OPEN,2020-02-08 00:19:00+00:00,Officer dispatched to take a report of an unlawful entry into a residence and a stolen Apple iPad valued at $500.00.,ADAMS HOUSE G - RANDOLPH HALL 45 BOW ST CAMBRIDGE,THEFT REPORT,2/7/20 1:00 PM - 11:30 PM
